line,text
214," In some countries the law might mean we have to share certain information, for example, with tax authorities."
215," Even in these cases, we’ll only share your information with people who have the right to see it."
216, You can get more details of the protection given to your information when it’s transferred outside the United Kingdom or the EEA by contacting us using the details in section 11 ‘How to contact us’.
217," The EEA is made up of all member states of the European Union and Iceland, Liechtenstein, and Norway."
219, Your rights You have a number of rights in relation to the information that we hold about you including: • The right to access information we hold about you and to get information about what we do with it.
220," • In some circumstances, the right to withdraw your permission to our processing of your information, that you can do at any time."
221, We may continue to process your information if we have another legitimate reason for doing so.
222," • In some circumstances, the right to receive certain information you have provided to us in an electronic format and/or ask that we send it to a third party."
223, 18 • The right to ask that we rectify your information if it’s inaccurate or incomplete.
224," • In some circumstances, the right to ask that we delete your information."
225, We may continue to keep your information if we’re entitled or required to retain it.
226," • The right to object to, and to ask that we limit our processing of your information in some circumstances."
227," Again, there may be situations where you object to, or ask us to limit our processing of your information but we’re entitled to continue and/or to refuse that request."
228, You can exercise your rights by contacting us using the details set out in the ‘How to contact us’ section.
229, You also have a right to complain to the UK Information Commissioner’s Office by visiting ico.
231,"uk, or to the data protection regulator in the country where you live or work."
233," Credit Reference Checks, Fraud and Money Laundering Credit Reference Checks If you apply for new products or services (including credit like a mortgage, personal loan, or credit card), we may carry out credit and identity checks on you with one or more credit reference agencies (CRAs)."
234," When you use our banking services, we may also make periodic searches at CRAs to manage your account with us."
235," To do this, we’ll supply your personal information to CRAs and they’ll give us details about you."
236, This will include information from your credit application and about your financial situation and financial history.
237," CRAs will supply us with both public (including the electoral register) and shared credit information, financial situation, history, and fraud prevention information."
238, We may use this information to: • Assess if we can offer you credit and whether you can afford the product you applied for.
239, • Verify the accuracy of the data you’ve given us.
240," 19 • Prevent criminal activity, fraud, and money laundering."
241, • Manage your account(s).
242, • Trace and recover debts.
243, • Ensure any offers provided to you are appropriate to your circumstances.
244, We’ll continue to exchange information about you with CRAs while you have a relationship with us.
245, We’ll also inform the CRAs about your repayment history.
246," If you borrow and do not repay in full and on time, CRAs will record the outstanding debt."
247, This information may be supplied to other organisations by CRAs.
248, When CRAs receive a search request from us they’ll place a search footprint on your credit file that may be seen by other lenders.
249," If you apply for a bank account or other credit (such as where you apply for a mortgage, loan or credit card) we’ll get details of your credit history from a CRA (and share information about you with the CRA) and use this information to work out how much you can afford to borrow or pay back."
250," We may use your information to confirm the accuracy of the information you’ve provided to us, prevent criminal activity, fraud and money laundering, manage your accounts, trace and recover debts and ensure any offers provided to you are appropriate to your circumstances."
251," If you’re making a joint application or tell us that you have a spouse or financial associate, we’ll link your records together."
252, You should discuss this with them and share this information with them before submitting the application.
253, CRAs will also link your records together and these links will remain on your and their files until you or your partner successfully files for a disassociation with the CRAs to break that link.
254," The identities of the CRAs, their role also as fraud prevention agencies, the data they hold, the ways in which they use and share personal information, data retention periods and your data protection rights with the CRAs are explained in more detail on their websites."
255, They’ve created a joint document called the Credit Reference Agency Information Notice (CRAIN) which is available from each of the three CRAs – going to any of these three links will also take you to the same CRAIN document: 20 Credit reference agencies: Transunion – transunion.
257,uk/crain Equifax – equifax.
259,uk/crain Experian – experian.
261,"uk/crain To comply with the law and for our own legitimate interest to allow us to assess and manage risk, we can share details about your financial situation and financial history with CRAs, fraud prevention agencies, etc."
262," This includes information on any bank accounts or credit you have with us, including: • How you manage your accounts or credit."
263, • If you owe us money.
264, • If we have concerns about financial crime.
265," • If you haven’t kept up with your payments or paid off any amount you owe us (unless there’s a genuine dispute over how much you owe us), or if you’ve agreed and stuck to a repayment plan."
266," Fraud Prevention Agencies We’ll carry out checks with fraud prevention agencies for the purposes of preventing fraud and money laundering, and to confirm your identity before we provide products and services to you."
267, These checks require us to process personal information about you.
268," The personal information you provide or which we’ve collected from you, or received from third parties, will be used to carry out these checks in order to prevent fraud and money laundering, and to verify your identity."
269," We’ll process personal information such as • your name • address • date of birth • contact details • financial information • employment details and • device identifiers, for example, IP address."
270," 21 We and fraud prevention agencies may also enable law enforcement agencies to access and use your personal data to detect, investigate and prevent crime."
271, We process your personal data on the basis that we have a legitimate interest in preventing fraud and money laundering and to verify your identity.
272, This enables us to protect our business and to comply with laws that apply to us.
273, This processing is also a contractual requirement of any of our products or services you use.
274, Fraud prevention agencies can hold your personal data for different periods of time.
275," If they’re concerned about a possible fraud or money laundering risk, your data can be held by them for up to six years."
276," As part of the processing of your personal data, decisions may be made by automated means."
277," This means we may automatically decide that you pose a fraud or money laundering risk if our processing reveals your behaviour to be consistent with money laundering or known fraudulent conduct, or is inconsistent with your previous submissions, or you appear to have deliberately hidden your true identity."
278," Consequences of Processing If we, or a fraud prevention agency, have reason to believe there’s a fraud or money laundering risk, we may refuse to provide the services and credit you’ve requested."
279, We may also stop providing existing products and services to you.
280, A record of any fraud or money laundering risk will be kept by the fraud prevention agencies.
281, This may also be used to enhance fraud detection models and may also result in others refusing to provide services to you.
282, The information we hold about you could make it easier or harder for you to get credit in the future.
283," To find out more about credit and fraud checks, read our ‘Guide to Credit Scoring, Credit Reference and Fraud Prevention Agencies’ leaflet."
284," You can get it from our website, in any of our branches or you can request a paper copy by contacting us in your preferred way."
285," 22 To find out more about our Fraud Prevention Agencies and how they manage your information, visit each agency directly: CIFAS – cifas."
287,uk/fpn National Hunter – nhunter.
289,uk/privacypolicy Synectics Solutions Ltd – synectics-solutions.
290,com/privacy BioCatch – biocatch.
291,com/privacy-policy LexisNexis (ThreatMetrix) – risk.
292,lexisnexis.
293,com/group/privacy-policy MasterCard (Vocalink) – mastercard.
295,uk/en-gb/vision/terms-of-use/commitment-to-privacy/privacy.
296,html 9.
297," What we need from you You’re responsible for making sure the information you give us is accurate and up to date, and you must tell us if anything changes as soon as possible."
298," If you give information for another person (for example, a joint account holder, a beneficiary under an insurance policy or a dependant), you’ll need to tell them how to find this notice and make sure they agree to us using their information as described in it."
300," How we keep your information secure We use a range of measures to keep your information safe and secure, which may include encryption and other forms of security."
301, We require our staff and any third parties who carry out any work for us to comply with appropriate compliance standards including obligations to protect any information and applying appropriate measures for the use and transfer of information.
302, 23 11.
303," More details about your information – how to contact us You can contact our Data Protection Officer (DPO) by writing to: The Data Protection Officer Customer Service Centre BX8 1HB You can exercise your rights, by writing to: Attention of Rights of Individuals Fulfilment (ROIF) Customer Service Centre BX8 1HB Alternatively, you can contact us via the HSBC UK Mobile Banking App where you can chat to us 24/7, via telephone banking or in branch."
304, The opening hours for our telephone banking customer service teams can be viewed at hsbc.
306,uk/contact.
308, Changes to our Privacy Notice This Privacy Notice may be updated from time to time and the most recent version can be found at hsbc.
310,uk/privacy-notice.
311, This notice was last updated in March 2024.
313, Appendix – How we process your information We’ll use your information for purposes including: • To deliver our products and services (including insurance): administer your accounts or process your transactions.
314, We’ll do this to perform our contract with you.
315," 24 • Banking operations support: we’ll use your information to allow the provision and function of our banking services in line with regulation, laws and customer rights and interests, for example, complaints management and exit management."
316," The lawful reasons for processing these are legitimate interest, legal obligation and to perform our contract with you."
317," • To prevent and detect crime including, for example, fraud, terrorist financing and money laundering: this will include monitoring, mitigation and risk management, carrying out customer due diligence, name screening, transaction screening and customer risk identification."
318, We do this to comply with our legal obligations and because it’s in our legitimate interest.
319," We may share your information with relevant agencies, law enforcement and other third parties where the law allows us to for the purpose of preventing or detecting crime."
320," Also, we and other financial institutions may take steps to help prevent financial crime and manage risk."
321," We’ll do this because we have a legitimate interest, a legal obligation to prevent or detect crime or it’s in the public interest."
322," We may be required to use your information to do this, even if you’ve asked us to stop using your information."
323," That could include (among other things): — Screening, intercepting and investigating any payments, instructions or communications you send or receive (including drawdown requests and application forms)."
324," — Investigating who you’re paying or who’s paying you, for example, checks on payments into and out of your account and other parties related to those payments."
325," — Passing information to relevant agencies if we think you’ve given us false or inaccurate information, or we suspect criminal activity."
326, — Combining the information we have about you with information from other HSBC companies to help us better understand any potential risk.
327, — Checking whether the people or organisations you’re paying or receiving payments from are who they say they are and aren’t subject to any sanctions.
328," 25 • Risk management: we’ll use your information to measure, detect and prevent the likelihood of financial, reputational, legal, compliance or customer risk."
329," This includes credit risk, traded risk, operational risk and insurance risk (for example, for underwriting or claims management purposes)."
330," We’ll do this because we have a legitimate interest in ensuring that we carry out a proper risk assessment before providing credit, insurance or other finance."
331," • Online Banking, Mobile Banking, and other mobile or online services: we’ll use your information to allow us to provide you with access to HSBC online platforms and mobile apps (for example, the HSBC UK Mobile Banking App This includes information you provide to us, directly or indirectly when using HSBC UK mobile apps, Online Banking or applying for products and services online."
332, The lawful basis for using your information for this purpose is to perform our contract with you or that processing for this purpose is in our legitimate interest.
333, • Product and service improvement: we’ll analyse your information to identify possible service and product improvements.
334," Where we provide you with aggregated information services, we’ll use your information to understand how you use these products, which may include your transactional information from other financial institutions to help improve our products and services."
335, The lawful basis for processing your information for this purpose is our legitimate interest.
336, We do this to improve our products and services to best meet the needs of our customers.
337, • Data analytics: we’ll analyse your information to identify opportunities to promote products and services to existing or prospective customers and to understand how our products and services are used.
338," For example, this may include reviewing historical customer transactional behaviour, comparison of customer activity or it may include an analysis of your transactional information or financial institutions."
339, We do this to help us provide you with products and services we think will be of most relevance to you.
340, The lawful basis for using your information in this way is our legitimate interest.
341," 26 • Marketing: we’ll use your information to provide you with information about HSBC products and services, and also products and services from our partners and other relevant third parties."
342," This includes marketing by post, email, telephone, text, secure messages, Mobile app or advertising to you and other people online and on social media."
343, The lawful basis for this is our legitimate interest.
344, We may need your consent to communicate by certain channels and we’ll always make sure we get this where we need to.
345, You can change your mind on how you receive marketing messages or choose to stop receiving them at any time.
346," To make that change, contact us using the details set out in the ‘More details about your information’ section."
347," • Protecting our legal rights: we may need to use your information to protect our legal rights, for example, in the case of defending or the protection of legal rights and interests (for example, collecting money owed, enforcing or protecting our security or defending rights of intellectual property); court action; managing complaints or disputes; in the event of a restructuring of companies or other mergers or acquisition."
348," This may be in connection with action taken against you or other persons, for example, joint borrowers or persons who give a guarantee or other security for your obligations to us."
349, The lawful basis for using your information in this way is our legitimate interest.
350," 27 Page intentionally left blank Accessibility If you need any of this information in a different format, please let us know."
351," This includes large print, braille, or audio."
352," You can speak to us using the live chat on our website, visiting one of our branches, or by giving us a call."
353, There are also lots of other options available to help you communicate with us.
354, Some of these are provided by third parties who are responsible for the service.
355," These include a Text Relay Service and a British Sign Language (BSL) Video Relay Service, to find out more please get in touch."
356, You can also visit: hsbc.
358,uk/accessibility or: hsbc.
360,uk/contact.
361, hsbc.
363,uk HSBC UK Bank plc.
364, Registered in England and Wales with number 09928412.
365," Registered Office: 1 Centenary Square, Birmingham B1 1HQ, United Kingdom."
366, Authorised by the Prudential Regulation Authority and regulated by the Financial Conduct Authority and the Prudential Regulation Authority.
367, Our Financial Services Register number is 765112.
368, RFB2085 CMT0614 ©HSBC Group 2024.
369, All Rights Reserved.
