line,text
0,Our Privacy Notice 2 Contents 1.
1, Introduction 3 2.
2, What information we collect 4 3.
3, How we’ll use your information 8 4.
4, Who we might share your information with 13 5.
5, How long we’ll keep your information 16 6.
6, Transferring your information overseas 17 7.
7, Your rights 17 8.
8," Credit Reference Checks, Fraud and Money Laundering 18 9."
9, What we need from you 22 10.
10, How we keep your information secure 22 11.
11, More details about your information – how to contact us 23 12.
12, Changes to our Privacy Notice 23 13.
13, Appendix – How we process your information 23 3 1.
14, Introduction This Privacy Notice applies to personal information held by members of the HSBC Group as data controllers.
15," It explains what information we collect about you, how we’ll use that information, who we’ll share it with, the circumstances when we’ll share it."
16," Also, what steps we’ll take to make sure it stays private and secure."
17," It continues to apply even if your agreement for banking, insurance or other products and services with us ends."
18," It should also be read alongside your banking or insurance terms and conditions, as these include sections relating to the use and disclosure of information."
19, This Privacy Notice covers any personal products or services you have with us.
20," Including current accounts, savings, loans, credit cards, mortgages, investments, and insurance."
21, Sometimes we may need to provide you with separate or further information about specific products and services.
22," If you also bank with other parts of the HSBC Group, for example, HSBC business banking, first direct, M&S Bank or HSBC in any other countries, they’ll provide you with information separately where required."
23, Some links on our websites lead to other HSBC or non-HSBC websites.
24," These have their own privacy notices, which may be different to this one."
25, You’ll need to make sure you’re happy with their privacy notices when using those sites.
26," Wherever we’ve said ‘you’ or ‘your’, this means: • You."
27, • Any authorised person on your account.
28," • Anyone who does your banking or deals with us for you, for example, trustees, executors or attorneys under a Power of Attorney."
29," • Other related people, for example, authorised signatories, partners, members, and trustees."
30," • If you’re an insurance customer it also means you, named insured parties or beneficiaries under your policy, dependants, claimants and other third parties involved in an insurance policy or claim such as witnesses."
31," When we say ‘we’, we mean HSBC Group companies, which act as a data controller for your personal data."
32," Unless otherwise stated, the data controller for the purposes of this notice is HSBC UK Bank plc."
33, The following HSBC Group companies will act as a data controller where you hold a product or service with them: HSBC Life (UK) Limited; HSBC Trust Company (UK) Limited; HSBC Executor and Trustee Company (UK) Limited; Trustees of The HSBC Self-Invested Personal Pension; and HSBC Finance Limited.
34," The address for the HSBC Group companies is 1 Centenary Square, Birmingham B1 1HQ."
35," If you’d like to get in touch with us, you can also find our contact details in section 11."
37, What information we collect We’ll only collect information about you as allowed by regulations and law.
38," We may collect it from a range of sources, and it may relate to any of our products or services you apply for, currently hold, or have held in the past."
39," We may also collect information about you when you interact with us through our websites or mobile channels, telephone banking or when you visit one of our branches."
40," Some of it will come directly from you, for example, when you provide identification to open an account."
41," It can also come from your financial advisor, broker or mortgage intermediary, other HSBC companies, the insurance company, which provides the insurance policies we offer, or other sources you’ve asked us to get information from."
42, We might also get some from publicly available places.
43, The information we collect will differ depending on the type of product you hold.
44," The information we collect may include: 4 5 Information that you provide to us, such as: • Personal details (for example, your name, previous names, gender, date and place of birth)."
45," • Contact details (for example, your postal address, email address, and telephone numbers)."
46," • Information concerning your identity (for example, photo identification, passport information, National Insurance number, National ID card and nationality)."
47," • Market research (for example, information and opinions given when participating in market research)."
48," • User login and subscription details (for example, login credentials for phone, online banking and mobile banking apps)."
49," • Other information that you give us by filling in forms or by communicating with us, whether face-to-face, by phone, email, online, or in other ways."
50," • If our relationship is because of an insurance policy or claim, we may also collect: — Information regarding your family or other people who might be covered by or benefit from your insurance policy, or be financially dependent on you — Relevant details including details of previous policies and claims history."
51," — Lifestyle information (for example, if you smoke and how much alcohol you drink)."
52," — Relevant details about your physical or mental health (for example, if you make a claim, we may ask for medical information)."
53, — Details about any criminal convictions or related information.
54, This includes details of offences or alleged offences.
55," — Any other information, which is relevant to a claim that you make."
56," Information we collect or provide about you, for example: • Your financial information and information about your relationship with us."
57, This includes the products and services you hold.
58," The channels you use, and your ways of interacting with us."
59," Your ability to get and manage credit, your payment history, transactions records, market trades, payments into your account including salary details and information about complaints and disputes."
60," • Information we use to identify and authenticate you (for example, your signature and your biometric information such as your voice for Voice ID, or additional information that we receive from external sources that we need for compliance purposes)."
61, • Geographic information such as which branches or cash machines you use.
62," • Information included in customer documentation (for example, a record of advice that we may have given you)."
63," • Marketing and sales information (for example, details of the services you receive and your preferences)."
64," • Information about your device or the software you use (for example, its IP address, technical specification and uniquely identifying data)."
65," • Cookies and similar technologies we use to recognise you, remember your preferences and tailor the content we provide to you – our cookie policy contains more details about how we use cookies and can be found at hsbc."
67,uk/cookie-notice.
68," • Risk rating information (for example, credit risk rating, transactional behaviour and underwriting information)."
69," • Investigations data (for example, due diligence checks, sanctions and anti-money laundering checks, external intelligence reports, content and metadata related to relevant exchanges of information between and among individuals and/or organisations, including emails, voicemail and live chat, etc."
71," • Records of correspondence and other communications between us (for example, email, live chat, instant messages, and social media communications)."
72," 6 • Information we need to support our regulatory obligations (for example, information about transaction details."
73, Detection of any suspicious and unusual activity and information about parties connected to you or these activities).
74," Information we collect from other sources, for example: • Information you’ve asked us to collect for you (for example, details about your accounts with us or other companies including transaction data)."
75," • Information from third party providers, (for example, that helps us to help prevent or detect fraud or that relates to your social interactions, such as your communications via social media, between individuals, organisations, prospects, and other stakeholders acquired from companies that collect combined information)."
76," • If our information arises out of an insurance policy or claim, we may also collect information about: — Your insurance application where you applied via a comparison website or aggregator."
77," — Your medical records, with your agreement."
78, — Your insurance claims history.
79, — Other parties involved in your insurance policy or claim.
80, — Publicly available sources.
81, 7 8 3.
82," How we’ll use your information We’ll only use your information if we have your permission, or we have another legal reason for using it."
83, These reasons include: • If we need to pursue our legitimate interests.
84, • If we need to process the information to enter into or carry out an agreement we have with you.
85," • If we need to process the information to comply with a legal obligation • where we believe it’s in the public interest for us to do so (for example, to help prevent or detect crime)."
86," • To establish, exercise or defend our legal rights."
87, • For insurance purposes.
88, The reasons we use your information include to: • Deliver our products and services.
89," • Carry out your instructions (for example, to fulfil a payment you request or a change to your insurance policy)."
90, • Carry out credit checks.
91, • Manage our relationship with you.
92, • Support banking operations.
93," • Prevent or detect crime including fraud and financial crime, for example, financing for terrorism and human trafficking."
94," • Manage risk, ensure security and business continuity."
95," • Provide online services such as Online Banking, Mobile Banking, mobile apps, and other online product platforms."
96," • Market our products and services to you, and to people like you, for example, through traditional and online advertising."
97," • Improve our products and services, including through analysing how you use them."
98, 9 • Carry out data analytics to better understand your circumstances and preferences so we can make sure we can provide you with the best advice and offer you a tailored service.
99, • Protect our legal rights and comply with our legal obligations.
100," • Correspond with solicitors, surveyors, valuers, other lenders, conveyancers, and third-party intermediaries."
101," • Carry out system or product development and planning, insurance, audit, and administrative purposes."
102," • Recover money that you owe us (for example, where you haven’t paid for your insurance policy)."
103," • If our relationship is because of an insurance policy or claim, we will also use your information to: — Look at your insurance application and provide you with a quote."
104," — Handle or monitor any claims that you make, or which arise under your insurance policy."
105," — Where relevant, bring a claim against a third party."
106, — Apply for and claim on our own insurance policies.
107, Further details of how we’ll use your information can be found in the Appendix in section 13.
108," How we make decisions about you We may use automated systems to help us make some of our decisions, for example, when you apply for products and services, to make credit decisions and to carry out fraud and money laundering checks."
109," We may also use technology to help us identify the level of risk involved in customer or account activity, for example, for credit, fraud or financial crime reasons, or to identify if someone else is using your card without your permission."
110," If you’re an insurance customer, we may also use automated systems to help us make decisions, for example, to determine whether or not we can offer you insurance and at what price."
111," We may base our decision on factors like health, lifestyle, and occupational information, as well as the level of cover being requested."
112, 10 You may have a right to certain information about how we make these decisions and ask for a decision to be made by a person instead of a computer.
113, More details can be found in the ‘Your rights’ section.
114," Tracking or recording what you say or do To help keep you and your money safe, we may store details of your interactions with us."
115, We may also record and keep track of conversations you have with us through: • phone calls • face-to-face meetings • letters • emails • live chats • video chats and • any other kinds of communication.
116," We may use these to check: • your instructions to us • assess, analyse and improve our service • train our people • manage risk or • prevent and detect fraud and other crimes."
117," We may also capture additional information about these interactions, for example, telephone numbers that you call us from and information about the devices or software that you use."
118, We use closed circuit television (CCTV) in and around our offices and branches and these may collect photos or videos of you or record your voice.
119," Our websites, apps, and other digital products may also track and record your interactions with them to help: • keep you safe • us provide or improve services and features 11 • keep our services secure • make your visit more personal or • support our marketing."
120, Some tracking is optional.
121," For more details, please refer to our relevant website, app or other digital privacy notices and cookies notices."
122, Compliance with laws and regulatory compliance obligations We’ll use your information to meet our compliance obligations.
123, We’ll also use it to comply with other laws and regulations.
124, We’ll share your information with regulators and other authorities that HSBC Group companies are subject to.
125," This may include using it to help detect or prevent crime (including terrorism financing, money laundering and other financial crimes)."
126," We’ll only do this if it’s needed to comply with a legal requirement, it’s in our legitimate interests and that of others, or to prevent or detect unlawful acts."
127," Marketing We may use your information to provide you with details about our products and services, and also products and services from other third parties."
128," We may send you marketing messages by post, email, telephone, text, secure messages, Mobile app, or through social media."
129," You can change your mind on how you receive marketing messages, or you can stop receiving them at any time."
130," To make that change, contact us in the usual way."
131," If you ask us not to send you marketing, it may take us a short period of time to update our systems and records to reflect your request, during which time you may continue to receive marketing messages."
132," Even if you tell us not to send you marketing messages, we’ll continue to use your contact details to send you important information."
133, Such as changes to your terms and conditions or if we need to tell you something to comply with our regulatory obligations.
134, 12 Market Research We may use your information for market research and to identify trends.
135, Market research agencies acting on our behalf may get in touch with you to invite you to take part in research.
136, We won’t invite you to take part in research using a communication method if you’ve asked us not to get in touch that way.
137, Any responses you provide will be reported back to us anonymously unless you give us permission for your details to be shared.
138," If you do not wish to be contacted for market research purposes, let us know by using the details set out in the ‘More details about your information’ section."
139," Facebook When you use an HSBC Page on Facebook, Meta Platforms Ireland Limited (previously known as Facebook Ireland Limited), and HSBC collect information about you."
140, This includes: • What you click on: if you start a messenger conversation.
141, • What you view: when you hover over a link or have an event page on screen.
142, • What you say: like comments or reactions.
143, • Your actions: like sharing or recommending.
144, • Your location: country or region.
145, This is not your precise location unless you have provided this in your user profile and you are logged in.
146, • Your device and internet connection.
147, • Your Facebook profile details and user ID.
148," HSBC has access to this information to use for reporting, insights and marketing purposes and so does Meta Platforms Ireland."
149, This helps HSBC improve our offering on Facebook and create better marketing.
150, HSBC may also see this information if HSBC has communicated with you on Facebook.
151, HSBC does this because it helps us know who we’re speaking to.
152," 13 If you’ve allowed us to use cookies that support our marketing, HSBC and Meta Platforms Ireland can collect this information when you use HSBC’s site too."
153," To learn more, or to switch this off, visit our Cookies Notice at hsbc."
155,uk/cookie-notice/.
156, You can control which cookies you allow by selecting “Manage Cookies”.
157, Meta Platforms Ireland is a ‘joint controller’ with us in law for processing where we collect information about you: • From your actions on our Facebook page.
158, • Through the Facebook pixel on our website.
159," We and Meta Platforms Ireland have agreed to share some responsibilities to protect your personal data, by: • Making sure we each have a legal basis for joint processing."
160, • Honouring your legal rights in respect of your data.
161, • Ensuring security of joint processing.
162, You can contact HSBC about how we do this.
163, You can also contact Meta Platforms Ireland about what they do.
164, This includes exercising your legal rights in respect of the data Facebook collects and retains itself.
165," Further details of how Meta Platforms Ireland processes your personal information, the legal basis it relies on, your rights and their contact details can be found at: facebook."
166,com/about/privacy.
168, Who we might share your information with We may share your information with others where lawful to do so including where we or they: • Need to in order to provide you with products or services you’ve asked for.
169, • Need to in order to provide you with your insurance policy or to administer your claim.
170," • Have a public or legal duty to do so, (for example, to help with detecting and preventing fraud, tax evasion and financial crime."
171," 14 • Need to for any regulatory reporting, litigation or asserting or defending legal rights and interests."
172," • Wish to send marketing to you or others, where you’ve given us your permission, or it’s within our legitimate interest to do so."
173," • Have a legitimate business reason for doing so, for example, to manage risk, confirm your identity, enable another company to provide you with services you’ve asked for, or check your suitability for products and services."
174," • Have asked you for your permission to share it, and you’ve agreed."
175," We may share your information for these purposes with others including: • Other HSBC Group companies and any sub-contractors, agents or service providers who work for us or provide services to us or other HSBC Group companies (including their employees, sub-contractors, service providers, directors, and officers)."
176," • Any joint account holders, trustees, beneficiaries, or executors."
177, • People who give guarantees or other security for any amounts you owe us.
178, • People you make payments to and receive payments from.
179," • Your beneficiaries, intermediaries, correspondent, and agent banks, clearing houses, clearing or settlement systems, market counterparties and any companies you hold securities in through us, for example, stocks, bonds, or options."
180," • Other financial institutions, lenders, and holders of security over any property you charge to us, tax authorities, trade associations, credit reference agencies, payment service providers and debt recovery agents."
181, • Any fund managers who provide asset management services to you and any brokers who introduce you to us or deal with us for you.
182," • Any entity that has an interest in the products or services that we provide to you, including if they take on the risk related to them."
183," • Any people or companies in connection with potential or actual corporate restructuring, merger, acquisition, or takeover, including any transfer or potential transfer of any of our rights or duties under our agreement with you."
184," 15 • Law enforcement, government, courts, dispute resolution bodies, our regulators, auditors, and any party appointed or asked for by our regulators to carry out investigations or audits of our activities."
185," • Other parties involved in any disputes, including disputed transactions."
186, • Fraud prevention agencies who will who will also use it to detect and prevent fraud and other financial crime and to confirm your identity.
187," • Anyone who provides instructions or operates any of your accounts on your behalf, for example, Power of Attorney, solicitors, intermediaries, etc."
188," • Anybody else that we’ve been asked to share your information with by either you, a joint account holder or anybody else who provides instructions or operates any of your accounts on your behalf."
189," • Our card processing suppliers to carry out credit, fraud, and risk checks, process your payments, issue and manage your card."
190," • If our relationship is because of an insurance policy or claim, we’ll also share your information with: — Other parties involved in providing your insurance policy, for example, the intermediary or insurer who provides your policy."
191," — Third parties involved in the administration of the relevant insurance policy or claim including loss adjusters, claims handlers, private investigators, experts, and our advisors."
192," — Where relevant, medical experts and rehabilitation providers."
193," Online advertising When we advertise our products and services on the internet, we may share your information with our advertising partners."
194," For example, when we use social media for marketing purposes, your information may be shared with the social media platforms so that they can check if you hold an account with them."
195," If you do, we may ask the social media partner or social media network: • To use your information to send our adverts to you, for example, because we think that you might be interested in a new service that we offer."
196," • To exclude you from receiving our adverts, for example, because the advert is for a service that you already use."
197," 16 • To advertise to people who have a similar profile to you, for example, if we discover that one of our services is particularly useful to people with similar interests to the ones on your social media profile, we may ask our advertising partner or the social media network to send our adverts for that service to people who share your interests."
198, You can contact us if you don’t wish us to share your personal data for online advertising.
199," For more information, see ‘Your rights’ in section 7."
200, Social media platforms also allow you to indicate your preferences to them about the advertising you receive on their platforms.
201, Please contact your social media platforms for more information.
202," Sharing aggregated or anonymised information We may share aggregated or anonymised information within and outside of the HSBC Group with partners such as research groups, universities or advertisers."
203," You won’t be able to be identified from this information, for example, we may share information about general spending trends in the UK to help in research."
205, How long we’ll keep your information We keep your information in line with our data retention policy.
206," For example, we’ll normally keep your main banking information for a period of seven years from when our relationship with you ends."
207, This allows us to comply with legal and regulatory requirements or use it where we need to for our legitimate purposes such as managing your account and dealing with any disputes or concerns that may arise.
208," We may need to keep your information for longer where we need the information to comply with regulatory or legal requirements, help detect or prevent fraud and financial crime, answer requests from regulators, etc."
209," If we don’t need to keep information for this length of time, we may destroy, delete or anonymise it sooner."
210, 17 6.
211," Transferring your information overseas Your information may be transferred to and stored in locations outside the United Kingdom or the European Economic Area (EEA), including countries that may not have the same level of protection for personal information."
212," When we do this, we’ll ensure it has an appropriate level of protection and that the transfer is in line with applicable legal requirements."
213," We may need to transfer your information in this way to carry out our contract with you, to fulfil a legal obligation, to protect the public interest and/or for our legitimate interests."
